record_id,crop_context,management_context,state_label,microbiome_indicator,indicator_direction,support_signal,risk_signal,generalizability_note,evidence_source,evidence_type,evidence_level,priority_score,notes
S3A201,maize fields considered for AMF inoculation,field-scale agricultural context,response-sensitive state,soil microbial biomass and pathogen-related community signatures,predictive mixture of positive and negative indicators,higher predicted AMF growth response in specific soil-microbiome states,poor microbiome contexts predict lower response,likely useful but context-dependent rather than universal,https://www.nature.com/articles/s41564-023-01520-w,field-scale predictive study,strong predictive evidence,5,Key source for response-sensitive state logic rather than simple health labels.
S3A202,agricultural soils across management depth profiles,fertility source tillage and cover crop management,management-shaped state,fungal modules and microbial assembly features,management-driven shift,more supportive assembly patterns under some fertility regimes,interaction structure can be weakened under some management conditions,depth and management effects limit universal interpretation,https://www.nature.com/articles/s42003-024-07059-8,comparative field systems study,strong management-linked evidence,5,Useful for linking soil state to management rather than only crop type.
S3A203,crop systems under sustainable soil management,sustainable or organic-like management regimes,support-oriented state,microbiome diversity and plant-defense linked changes,positive support direction,increased crop defense and beneficial microbiome association under supportive management,less supportive states under conventional pressure or weaker diversity,likely system-dependent and should not be generalized without context,https://www.nature.com/articles/s44264-025-00109-6,field-linked sustainability study,moderate-to-strong support-state evidence,4,Good support-side anchor for the classifier.
S3A204,watermelon rhizosphere under different cropping and amendment systems,cropping pattern and amendment management,limited-generalizability state,healthy-plant-associated indicators,variable,healthy-associated indicators appear in some systems,indicator transfer breaks under diverse management and cropping systems,explicitly shows that cross-system generalization is limited,https://www.sciencedirect.com/science/article/pii/S092913932500575X,comparative rhizosphere study,strong cautionary evidence,5,Essential for preventing overclaiming in the classifier.
S3A205,multiple crops under environmental stress and agronomic practices,stress and practice-linked rhizosphere contexts,stress-sensitive state,beneficial genera and stress-linked microbiome shifts,mixed context-dependent signal,some taxa and interactions align with better adaptation,persistent stress and harmful practices can degrade support functions,review-level synthesis and not enough for universal deployment alone,https://www.sciencedirect.com/science/article/pii/S2667064X25003306,review,moderate synthesis evidence,4,Useful for defining the stressed-state side of the vocabulary.
S3A206,arable farming systems under diverse management,soil testing and routine indicator context,indicator-priority state,microbial indicators used in soil-health testing,indicator prioritization rather than binary direction,helps prioritize which indicators may deserve routine attention,shows not all indicators are equally sensitive or useful,sensitivity depends on management practice and soil context,https://www.sciencedirect.com/science/article/pii/S1470160X24011634,meta-analysis,strong indicator-selection evidence,4,Useful for deciding which indicators belong in a practical field-facing panel.
