record_id,crop_or_genotype_context,stress_context,recovery_or_priming_condition,resilience_indicator,yield_stability_signal,growth_stage_context,adaptation_logic,evidence_source,evidence_type,evidence_level,priority_score,notes
S3C201,wheat genotypes,recurrent combined heat and deficit irrigation,priming at stem elongation or booting before later stress,stress-memory response and retained performance,primed plants outperformed non-primed plants in yield traits,post-anthesis and earlier priming stages,benefit depends on genotype and priming stage,https://www.sciencedirect.com/science/article/pii/S2667064X25004531,direct study,direct-high,5,strong recurrent-stress source
S3C202,wheat,drought priming followed by low temperature stress,drought priming before cold challenge,improved photosynthesis and lower oxidative damage,priming supports later stress tolerance rather than only immediate recovery,post-priming later cold exposure,stress memory through metabolic and hormonal regulation,https://www.sciencedirect.com/science/article/pii/S2773126X25000115,direct study,direct-high,4,strong priming logic source
S3C203,barley lines,drought followed by rewatering,rewatering after drought,recovery and resilience metrics separate from vigor,recovery does not automatically equal highest yield,pre-treatment drought and rewatering phases,distinguish vigor resilience recovery and final yield,https://www.frontiersin.org/journals/plant-science/articles/10.3389/fpls.2024.1393991/full,direct study,direct-high,5,strong recovery interpretation source
S3C204,barley cultivars,heat stress in field and controlled environments,single and combined heat stress treatments,distinct response clusters and compensatory response types,grain number and grain weight compensation in some groups,heading and reproductive phases,field response can differ from controlled-environment patterns,https://www.sciencedirect.com/science/article/pii/S0098847224003964,direct study,direct-high,4,useful for compensation logic
S3C205,multiple horticultural and grain crops,climate stress affecting reproduction,integrative resilience framing,reproductive resilience as core target,yield protection depends on preserving reproductive processes,reproductive development,combine genetics agronomy and integrative support,https://www.sciencedirect.com/science/article/pii/S2667064X24003579,review,review-high,4,strong applied framing source
S3C206,maize hybrids,drought and high VPD,newer breeding lines under stressed environments,drought resistance during reproductive stage,improved yield stability in newer hybrids under drought,grain filling to maturity,reproductive-stage drought tolerance and limited transpiration traits,https://www.nature.com/articles/s41467-025-64454-3,field-scale analysis,direct-high,5,strong yield-stability source
S3C207,multiple plant species,abiotic and biotic stress priming,various priming treatments,primed state and faster defense activation,priming can reduce losses under recurring stress but is context-sensitive,whole lifecycle and repeated stress exposure,priming as adaptive preparation not universal fix,https://www.sciencedirect.com/science/article/pii/S2352407325000241,review,review-medium,3,conceptual support source
