record_id,pathway_or_process,method_or_source_type,mechanism_role,evidence_source,evidence_type,evidence_level,priority_score,interpretation_note,limit_note,notes
S4B201,pathway analysis discipline,method critique,guards against overclaiming,https://www.nature.com/articles/s42255-025-01283-0,commentary,method-high,5,core caution source for prioritization,does not provide a dataset itself,anchor source
S4B202,functional metabolomics workflow,software and workflow,standardizes inputs before mechanism ranking,https://www.nature.com/articles/s41467-024-48009-6,method paper,method-high,5,useful for reproducible preprocessing and interpretation,workflow output still needs biological interpretation,tool backbone
S4B203,enrichment-method sensitivity,method comparison,tests whether pathway signal is robust to method choice,https://pmc.ncbi.nlm.nih.gov/articles/PMC12301278/,comparative study,direct-medium,4,method agreement can strengthen mechanism priority,scope is method-specific,quality-control source
S4B204,metabolic activity inference,integrative model,adds activity context to pathway logic,https://www.sciencedirect.com/science/article/pii/S2211124725001469,primary method study,direct-medium,4,activity inference can sharpen process ranking,context-specific modeling assumptions apply,mechanism bridge
S4B205,pathway-guided mediation,statistical method,connects metabolite shifts to pathway-level mediation,https://arxiv.org/abs/2503.13894,preprint method,method-medium,3,useful for causal-structure thinking,preprint and method-focused,optional method source
S4B206,metabolome-phenome atlas,large cohort resource,cross-condition process prioritization,https://www.nature.com/articles/s42255-025-01371-1,large cohort resource,direct-high,5,large-scale context for recurring metabolic patterns,population-level association is not mechanism proof,cross-condition anchor
