record_id,candidate_or_method,evidence_layer,plausibility_role,evidence_source,evidence_type,evidence_level,priority_score,interpretation_note,limit_note,notes
S4E201,network pharmacology workflows,method risk,weak-claim filter,https://www.sciencedirect.com/science/article/pii/S2090123224006180,critical review,review-high,5,essential caution source for inflated claims,review not a candidate dataset,method filter
S4E202,metabolomics-driven discovery,target and mechanism support,translation framing,https://www.sciencedirect.com/science/article/abs/pii/S0045206825012581,review,review-medium,4,positions metabolomics as discovery accelerator,does not validate individual candidates,general translation source
S4E203,metabolomics for therapeutic targets,biomarker and target support,discovery-layer framing,https://www.mdpi.com/2780828,review,review-medium,3,useful for defining support types,broad review scope,background source
S4E204,serum pharmacochemistry case,compound-target-metabolite convergence,layered plausibility example,https://www.sciencedirect.com/science/article/abs/pii/S0378874124010122,applied study,direct-medium,4,concrete example of layered candidate inference,condition-specific,case source
S4E205,multi-layer candidate inference,omics and target convergence,comparative shortlist example,https://www.mdpi.com/3407586,applied study,direct-medium,4,useful for evidence-depth comparison,case-specific method stack,multilayer example
S4E206,natural-product profiling,chemical profile support,origin and composition layer,https://www.sciencedirect.com/science/article/abs/pii/S0026265X24018915,review,review-medium,3,helps separate profiling from mechanism claims,profiling alone is not validation,chemical-profile source
