record_id,biomarker,biological_role,matrix,state_or_stage,specificity_issue,panel_role,evidence_source,evidence_type,evidence_level,priority_score,interpretation_note,limit_note,notes
S5A201,GFAP,astrocytic activation,CSF and plasma,AD continuum and longitudinal outcomes,not fully disease-specific,strong panel-supportive marker,https://www.nature.com/articles/s41380-025-02939-9,systematic literature review,review-high,5,strong neuroinflammation source,stage and matrix context required,high-priority marker
S5A202,multiple inflammatory markers,immune response and glial activation,CSF and blood,AD and ADRD research contexts,single markers insufficient,standardization anchor,https://link.springer.com/article/10.1186/s12974-025-03432-4,roadmap consensus paper,methods-high,5,strongest claim-discipline source,blood-only CNS inference is weak,essential methods source
S5A203,GFAP YKL-40 sTREM2,astrocytic microglial and inflammatory signals,CSF and plasma,AD continuum,marker changes are time and disease-context dependent,panel-supportive stage-context markers,https://link.springer.com/article/10.1186/s12974-024-03163-y,review,review-medium,4,useful ATI(N) and longitudinal framing,specificity remains limited,good stage source
S5A204,GFAP NfL YKL-40 MCP-1 neurogranin GAP-43 S100B NSE,glial activation and neurodegeneration,blood,AD continuum and controls,marker overlap with other neurodegenerative or aging states,blood-panel evidence source,https://www.sciencedirect.com/science/article/pii/S053155652500289X,systematic review and meta-analysis,review-high,5,strong blood-marker evidence,AD-defined cohorts needed for validation,good quantitative source
S5A205,extracellular vesicle biomarkers,disease-associated molecular cargo,general and CNS-enriched EVs,ADRD diagnostic research,CNS-enriched claims and heterogeneity require caution,emerging exploratory panel layer,https://www.nature.com/articles/s44400-024-00002-y,systematic review and meta-analysis,review-medium,3,useful emerging marker-carrier source,heterogeneity and enrichment assumptions limit use,exploratory layer
S5A206,imaging and fluid biomarkers,complementary pathology and disease-state signals,PET CSF plasma,AD patient selection and therapy context,marker types answer different questions,complementarity design source,https://pubmed.ncbi.nlm.nih.gov/40480828/,review,review-medium,4,supports integrated panels over competition,therapy-selection context not universal,good panel-design source
