record_id,risk_or_support_domain,factor,life_course_or_context,cognitive_endpoint,profile_role,evidence_source,evidence_type,evidence_level,priority_score,interpretation_note,limit_note,notes
S5B201,modifiable dementia risk,multiple life-course risk factors,life-course dementia prevention,dementia and cognitive decline,risk overlay anchor,https://www.thelancet.com/commissions/dementia-prevention-intervention-care,commission report,review-high,5,strong public-health risk framework,population-level estimates not individual prediction,main framework source
S5B202,cognitive reserve,reserve proxies and neuroimaging moderation,aging and AD-signature brain changes,cognition under pathology,reserve modifier,https://pubmed.ncbi.nlm.nih.gov/40763356/,systematic review,review-medium,5,explains vulnerability differences under similar pathology,heterogeneous reserve measures,connects B and D lanes
S5B203,social context,social isolation and loneliness,older adult social exposure,cognitive decline and dementia risk,social vulnerability layer,https://pubmed.ncbi.nlm.nih.gov/40653340/,review,review-medium,4,important context factor,intervention effects need stronger evidence,good support source
S5B204,cognitive engagement,technology use,digital exposure in older adults,cognitive aging outcomes,possible engagement or reserve layer,https://www.nature.com/articles/s41562-025-02159-9,meta-analysis and systematic review,review-medium,4,useful protective-context candidate,observational confounding remains possible,avoid simple techno-optimism
S5B205,modifiable MCI risk,multiple modifiable factors,older adult risk context,MCI risk,practical modifiability layer,https://www.sciencedirect.com/science/article/pii/S1568163724001685,systematic review and meta-analysis,review-medium,4,useful pre-dementia risk factor layer,evidence differs by factor,applied context
S5B206,vascular vulnerability,endothelial and microvascular dysfunction,vascular aging and small vessel context,cognitive decline,vascular context layer,https://www.mdpi.com/2077-0383/14/23/8543,systematic review and meta-analysis,review-medium,4,connects vascular health to cognition,marker heterogeneity limits direct scoring,good biological context
