record_id,plant_system,pathogen_context,signature_name,signature_class,defense_layer,mechanism_note,evidence_source,evidence_type,evidence_level,priority_score,notes
S2D001,Solanum lycopersicum,Ralstonia solanacearum bacterial wilt,ethylene-maintained PR gene expression,hormone-transcriptional signature,early immune maintenance,"Ethylene induces SlbHLH25 and SlbHLH25-like and sustains PR gene expression in resistant cultivars","https://www.frontiersin.org/journals/plant-science/articles/10.3389/fpls.2025.1753391/full",primary transcriptomic and infection study,strong primary evidence,5,High-priority bacterial-resistance signature because the axis is specific and mechanistically explicit.
S2D002,Arabidopsis thaliana,bacterial disease resistance context,salicylic acid accumulation,hormone signature,defense hormone signaling,"Free SA content rises alongside disease resistance and PR1-related signaling","https://www.mdpi.com/2223-7747/13/19/2766 | https://www.nature.com/articles/s41586-025-09175-9",primary mechanistic and pathway studies,strong primary evidence,5,Useful anchor marker because SA is both observed and mechanistically grounded.
S2D003,Arabidopsis thaliana,bacterial disease resistance context,callose deposition,cell-wall defense signature,early barrier response,"Loss of callose synthase abolishes the observed resistance gain, marking callose as a determinant signature","https://www.mdpi.com/2223-7747/13/19/2766",primary mechanistic study,strong primary evidence,5,Core barrier marker for any compact plant-defense panel.
S2D004,Triticum aestivum,Stagonospora nodorum fungal interaction,SA-JA-ET network balance,hormone-network signature,hormone crosstalk,"Resistance and susceptibility are shaped through differential control of SA, JA, and ethylene pathways","https://www.mdpi.com/2223-7747/13/18/2546",primary comparative hormone study,moderate-to-strong primary evidence,4,Important fungal-context marker because it prevents the panel from becoming bacteria-biased.
S2D005,Actinidia valvata vs Actinidia chinensis,Pseudomonas syringae pv. actinidiae (Psa),PR proteins and receptor kinase activation,immune transcription signature,recognition and downstream defense,"Resistant genotype shows stronger enrichment of PR proteins, receptor kinases, MAPK, and hormone signaling pathways","https://www.frontiersin.org/journals/plant-science/articles/10.3389/fpls.2026.1724662/full",primary transcriptome-metabolome comparison,strong primary evidence,5,High-value comparative record because it links resistance phenotype to a coordinated defense program.
S2D006,Actinidia valvata vs Actinidia chinensis,Pseudomonas syringae pv. actinidiae (Psa),phenylpropanoid-linked defense metabolites,defense metabolite signature,chemical defense output,"Resistant material shows defensive enrichment of flavonoids and phenolic acids tied to phenylpropanoid metabolism","https://www.frontiersin.org/journals/plant-science/articles/10.3389/fpls.2026.1724662/full",primary metabolomic comparison,strong primary evidence,4,Good bridge between transcript signatures and metabolite outputs.
S2D007,Arabidopsis thaliana,antifungal resistance context,camalexin control,phytoalexin signature,defense metabolite output,"WRKY15 suppresses PAD3 and GSTU4, reducing camalexin synthesis and antifungal resistance","https://pubmed.ncbi.nlm.nih.gov/39628054/",primary regulatory study,strong primary evidence,4,Key metabolite-side signature that keeps the panel from being only hormone-centered.
